{
  "$schema": "./contract.schema.json",
  "contract": {
    "id": "nix-ai-core",
    "version": "2.0.0",
    "status": "BINDING",
    "immutability": {
      "content_addressed": true,
      "mutation": "PROHIBITED",
      "successor": "NEW_SEMVER_AND_NEW_DIGEST"
    },
    "target": {
      "repository": "AtonoRobotics/Nix-AI",
      "baseline_commit": "c61d6be13cd9593284c32249c5b9a11691df0f67"
    }
  },
  "authority": {
    "precedence": [
      "CURRENT_PROJECT_EXPLICIT_USER_DECISION",
      "NIX_AI_V2_CONTRACT",
      "NIX_AI_V2_MACHINE_SCHEMAS",
      "NIX_AI_V2_GENERATED_REGISTRIES",
      "IMPLEMENTATION_EVIDENCE"
    ],
    "admissible_sources": [
      "CURRENT_USER_DECISION",
      "V2_DERIVATION"
    ],
    "inadmissible_sources": [
      "PRIOR_PROJECT",
      "ASSISTANT_PREFERENCE",
      "IMPLEMENTER_PREFERENCE",
      "EXAMPLE_PROMOTION",
      "VENDOR_PROMOTION",
      "DOMAIN_PROMOTION",
      "V1_BEHAVIOR"
    ],
    "default": "DENY"
  },
  "mission": {
    "product": "BOOTABLE_AUTONOMOUS_AGENT_OPERATING_SYSTEM",
    "kernel": "LINUX",
    "construction": "NIX",
    "native_principal": "DURABLE_AGENT",
    "autonomy": "NO_ACTIVE_HUMAN_SESSION_REQUIRED"
  },
  "scope": {
    "allowed_core_concepts": [
      "machine_identity",
      "agent_identity",
      "activation_identity",
      "objective",
      "wake",
      "lease",
      "durable_state",
      "evidence",
      "context_request",
      "context_bundle",
      "capability_grant",
      "authority_decision",
      "effect",
      "execution_boundary",
      "cognition_backend",
      "harness_adapter",
      "capability_package",
      "system_generation",
      "recovery",
      "generic_hardware_profile"
    ],
    "prohibited_core_semantics": [
      "business_domain_entity",
      "application_workflow",
      "embodiment_specific_principal",
      "domain_specific_effect_class",
      "domain_specific_safety_policy",
      "domain_specific_hardware_profile",
      "domain_fixture_in_core_test",
      "vendor_specific_principal",
      "vendor_specific_core_capability",
      "vendor_specific_execution_kind",
      "vendor_specific_release_gate",
      "provider_transcript_as_authoritative_state",
      "prompt_as_authority",
      "unapproved_generic_extension_hook"
    ]
  },
  "canonical_model": {
    "principals": [
      "MACHINE",
      "AGENT",
      "ACTIVATION",
      "HUMAN",
      "SERVICE",
      "EXTERNAL"
    ],
    "records": [
      "Machine",
      "SystemGeneration",
      "Agent",
      "Objective",
      "Wake",
      "Activation",
      "Lease",
      "ContextRequest",
      "ContextBundle",
      "CapabilityDefinition",
      "Grant",
      "Revocation",
      "AuthorityDecision",
      "Command",
      "Effect",
      "EffectAttempt",
      "Observation",
      "Reconciliation",
      "Package",
      "PackageEvaluation",
      "ActivationSet",
      "EvidenceObject",
      "ChangeProposal",
      "QualificationResult"
    ],
    "services": [
      {"id": "bootstrap", "owns": ["recovery_order", "readiness"], "must_not_own": ["objectives", "effect_execution"]},
      {"id": "identity", "owns": ["principal_identity", "activation_identity"], "must_not_own": ["authority_policy", "effects"]},
      {"id": "state", "owns": ["transactional_truth", "transition_history"], "must_not_own": ["cognition", "external_effects"]},
      {"id": "scheduler", "owns": ["wakes", "leases", "activation_admission"], "must_not_own": ["effect_execution", "authority_policy"]},
      {"id": "context", "owns": ["context_requests", "context_bundles", "context_provenance"], "must_not_own": ["authority", "effect_execution"]},
      {"id": "authority", "owns": ["grants", "revocations", "decisions"], "must_not_own": ["provider_credentials", "effects", "cognition"]},
      {"id": "effect", "owns": ["reservations", "attempts", "observations", "reconciliation"], "must_not_own": ["cognition", "grant_issuance"]},
      {"id": "execution", "owns": ["isolation", "resources", "workspaces"], "must_not_own": ["semantic_authority", "durable_agent_identity"]},
      {"id": "cognition", "owns": ["normalized_reasoning_invocation"], "must_not_own": ["durable_agent_identity", "effects", "authority"]},
      {"id": "package", "owns": ["package_admission", "activation_sets"], "must_not_own": ["self_approval", "system_signing"]},
      {"id": "evidence", "owns": ["protected_evidence", "evidence_references"], "must_not_own": ["evaluated_execution", "completion_policy"]},
      {"id": "generation", "owns": ["build", "stage", "activation", "rollback"], "must_not_own": ["unilateral_evaluation", "unilateral_signing"]}
    ],
    "effect_classes": ["E0", "E1", "E2", "E3"],
    "effect_states": [
      "PROPOSED",
      "REJECTED",
      "RESERVED",
      "EXECUTING",
      "OBSERVED_SUCCEEDED",
      "OBSERVED_FAILED",
      "OUTCOME_UNKNOWN",
      "RECONCILING",
      "RESOLVED_SUCCEEDED",
      "RESOLVED_FAILED",
      "AUTHORITY_REQUIRED"
    ],
    "execution_profiles": [
      "NATIVE_SERVICE",
      "ISOLATED_PROCESS",
      "WASI_COMPONENT",
      "OCI_CONTAINER",
      "MICROVM",
      "REMOTE_PROVIDER"
    ],
    "hardware_profiles": [
      "qemu-x86_64-conformance",
      "generic-x86_64",
      "generic-aarch64"
    ],
    "change_states": [
      "PROPOSED",
      "BUILT",
      "EVALUATED",
      "REJECTED",
      "QUALIFIED",
      "SIGNED",
      "STAGED",
      "ACTIVATED_CANDIDATE",
      "CONFIRMED",
      "ROLLED_BACK"
    ],
    "error_codes": [
      "INVALID",
      "UNAUTHORIZED",
      "UNAVAILABLE",
      "STALE",
      "RESOURCE_EXHAUSTED",
      "INCOMPATIBLE",
      "OUTCOME_UNKNOWN",
      "INCOMPATIBLE_DOMAIN_SEMANTICS",
      "INTERNAL"
    ]
  },
  "requirements": [
    {
      "id": "SCOPE-001",
      "source_authority": "CURRENT_USER_DECISION",
      "source_reference": "user-directive:2026-08-30:keep-only-non-domain-specific",
      "trigger": "Any core requirement, type, state, dependency, test, fixture, generated artifact, or build output is introduced or changed.",
      "shall": "Admit the semantic only when it maps to an allowed core concept and has an admissible source reference.",
      "boundary": "Prior projects, examples, vendors, domains, assistant preferences, implementer preferences, and v1 behavior are non-authoritative.",
      "failure": "Reject the change before build; do not create a normative artifact.",
      "owner_packet": "W00",
      "enforcement": ["scope_registry", "semantic_diff_gate", "default_deny_admission"],
      "evidence": ["scope-report.json"],
      "acceptance": "unmapped_semantic_count == 0 and inadmissible_source_count == 0"
    },
    {
      "id": "SCOPE-002",
      "source_authority": "CURRENT_USER_DECISION",
      "source_reference": "user-directive:2026-08-30:delete-domain-specific-implementation",
      "trigger": "A repository unit contains any prohibited core semantic.",
      "shall": "Delete the unit and rebuild it only if a v2 requirement requires replacement behavior.",
      "boundary": "Renaming, conditional disabling, deprecation, tombstoning in active code, or wrapping the contaminated implementation does not satisfy deletion.",
      "failure": "Mark the unit DELETE_AND_REBUILD and block integration.",
      "owner_packet": "W00",
      "enforcement": ["repository_disposition_ledger", "retention_predicate"],
      "evidence": ["deletion-report.json", "retention-ledger.json"],
      "acceptance": "contaminated_retained_unit_count == 0"
    },
    {
      "id": "SCOPE-003",
      "source_authority": "V2_DERIVATION",
      "source_reference": "SCOPE-001",
      "trigger": "A binding v2.0.0 contract file is changed.",
      "shall": "Reject mutation and require a new semantic version and new content digest.",
      "boundary": "No in-place correction of a released contract is permitted.",
      "failure": "Fail V-CONTRACT and V-SCOPE.",
      "owner_packet": "W00",
      "enforcement": ["sha256_manifest", "immutable_version_path", "ci_diff_guard"],
      "evidence": ["manifest-report.json", "contract-mutation-negative-test.json"],
      "acceptance": "all_contract_hashes_match == true and released_contract_modified == false"
    },
    {
      "id": "CORE-001",
      "source_authority": "CURRENT_USER_DECISION",
      "source_reference": "project-goal:autonomous-governed-agents-inside-os-habitat",
      "trigger": "An agent is created, activated, suspended, migrated, or resumed.",
      "shall": "Maintain one durable agent identity independent of activation, model, harness, process, container, and system generation.",
      "boundary": "A cognition backend or harness cannot own or replace the durable identity.",
      "failure": "Block activation or resume from durable identity and last committed state.",
      "owner_packet": "W03",
      "enforcement": ["agent_record", "activation_foreign_key", "abi_identity_check"],
      "evidence": ["backend-replacement-report.json", "activation-recovery-report.json"],
      "acceptance": "agent_id is unchanged across backend replacement and host restart"
    },
    {
      "id": "CORE-002",
      "source_authority": "CURRENT_USER_DECISION",
      "source_reference": "project-goal:autonomous-real-work",
      "trigger": "No human session is active.",
      "shall": "Continue admitting wakes, activations, bounded capability use, effect reconciliation, recovery, and completion.",
      "boundary": "Human authority is invoked only by an explicit policy requirement.",
      "failure": "Enter BLOCKED_AUTHORITY only when required authority is absent; do not require login for routine operation.",
      "owner_packet": "W05",
      "enforcement": ["system_services", "durable_scheduler", "standing_grants"],
      "evidence": ["headless-autonomy-report.json"],
      "acceptance": "end_to_end_objective_completed_without_active_human_session == true"
    },
    {
      "id": "SYS-001",
      "source_authority": "V2_DERIVATION",